head_cui,head_name,rel,tail_cuis_list,tail_names_list,tail_names,tail_cuis,tail_cuis_len,tail_names_len,avg_match,avg_rouge_l
C1333858,Grade 3 Rectal Adenocarcinoma,disease_has_normal_cell_origin,"['C0014597', 'C1517548']","['Epithelial Cell', 'Glandular Cell']",Epithelial Cell || Glandular Cell,C0014597 || C1517548,2,2,0.0,0.0
C0700636,Focal Nodular Hyperplasia of the Liver,disease_has_normal_cell_origin,['C0227525'],['Hepatocyte'],Hepatocyte,C0227525,1,1,0.0,0.0
C5237398,Infiltrating Bladder Mixed Carcinoma,disease_has_normal_cell_origin,"['C0007634', 'C0014597']","['Cell', 'Epithelial Cell']",Cell || Epithelial Cell,C0007634 || C0014597,2,2,0.0,0.0
C5418767,Recurrent Platinum-Resistant Ovarian Carcinoma,disease_has_normal_cell_origin,['C0014597'],['Epithelial Cell'],Epithelial Cell,C0014597,1,1,0.0,0.0
C5206813,Locally Advanced Gastric Carcinoma,disease_has_normal_cell_origin,['C0014597'],['Epithelial Cell'],Epithelial Cell,C0014597,1,1,0.0,0.0
C0279070,Adult Oligodendroglioma,disease_has_normal_cell_origin,"['C0027836', 'C0028944', 'C1449624', 'C1518293']","['Glial Cell', 'Oligodendrocyte', 'Neuroepithelial Cell', 'Neuron, Neuroepithelial Cell, and Supporting Cell of the Nervous System']","Glial Cell || Oligodendrocyte || Neuroepithelial Cell || Neuron, Neuroepithelial Cell, and Supporting Cell of the Nervous System",C0027836 || C0028944 || C1449624 || C1518293,4,4,0.0,0.0
C1519503,Stage 0 Renal Pelvis and Ureter Cancer AJCC v7,disease_has_normal_cell_origin,"['C0014597', 'C0225340', 'C1519839']","['Epithelial Cell', 'Transitional Cell', 'Urothelial Cell']",Epithelial Cell || Transitional Cell || Urothelial Cell,C0014597 || C0225340 || C1519839,3,3,0.0,0.0
C1335906,Salivary Gland Oncocytoma,disease_has_normal_cell_origin,['C0014597'],['Epithelial Cell'],Epithelial Cell,C0014597,1,1,0.0,0.0
C1334633,Mature B-Cell Neoplasm,disease_has_normal_cell_origin,"['C0004561', 'C0024264', 'C1512385', 'C1513019']","['B-Lymphocyte', 'Lymphocyte', 'Hematopoietic and Lymphoid Cell', 'Mature B-Lymphocyte']",B-Lymphocyte || Lymphocyte || Hematopoietic and Lymphoid Cell || Mature B-Lymphocyte,C0004561 || C0024264 || C1512385 || C1513019,4,4,0.0,0.09999999880000002
C1336147,Stage IB Vulvar Carcinoma AJCC v6,disease_has_normal_cell_origin,['C0014597'],['Epithelial Cell'],Epithelial Cell,C0014597,1,1,0.0,0.0
C0855155,Ann Arbor Stage I Primary Mediastinal (Thymic) Large B-Cell Cell Lymphoma,disease_has_normal_cell_origin,"['C0004561', 'C0024264', 'C1512385', 'C1513019', 'C1515428']","['B-Lymphocyte', 'Lymphocyte', 'Hematopoietic and Lymphoid Cell', 'Mature B-Lymphocyte', 'Thymic B-Lymphocyte']",B-Lymphocyte || Lymphocyte || Hematopoietic and Lymphoid Cell || Mature B-Lymphocyte || Thymic B-Lymphocyte,C0004561 || C0024264 || C1512385 || C1513019 || C1515428,5,5,0.0,0.026666665884444468
C1335687,Rectal Rhabdomyosarcoma,disease_has_normal_cell_origin,"['C0009781', 'C0596981', 'C1704336']","['Connective and Soft Tissue Cell', 'Muscle Cell', 'Skeletal Muscle Cell']",Connective and Soft Tissue Cell || Muscle Cell || Skeletal Muscle Cell,C0009781 || C0596981 || C1704336,3,3,0.0,0.0
C1708565,Invasive Cutaneous Melanoma,disease_has_normal_cell_origin,['C0025201'],['Melanocyte'],Melanocyte,C0025201,1,1,0.0,0.0
C4331341,Stage IVB Hypopharyngeal Carcinoma AJCC v8,disease_has_normal_cell_origin,['C0014597'],['Epithelial Cell'],Epithelial Cell,C0014597,1,1,0.0,0.0
C3272805,Colorectal Adenomatous Polyp,disease_has_normal_cell_origin,"['C0007634', 'C0014597', 'C1517548']","['Cell', 'Epithelial Cell', 'Glandular Cell']",Cell || Epithelial Cell || Glandular Cell,C0007634 || C0014597 || C1517548,3,3,0.0,0.0
C0855116,Ann Arbor Stage IV Diffuse Large B-Cell Lymphoma,disease_has_normal_cell_origin,"['C0004561', 'C0024264', 'C1512385', 'C1513019']","['B-Lymphocyte', 'Lymphocyte', 'Hematopoietic and Lymphoid Cell', 'Mature B-Lymphocyte']",B-Lymphocyte || Lymphocyte || Hematopoietic and Lymphoid Cell || Mature B-Lymphocyte,C0004561 || C0024264 || C1512385 || C1513019,4,4,0.0,0.0
C2981671,Stage IB Ampulla of Vater Cancer AJCC v7,disease_has_normal_cell_origin,['C0014597'],['Epithelial Cell'],Epithelial Cell,C0014597,1,1,0.0,0.0
C0854824,Ann Arbor Stage III Noncutaneous Anaplastic Large Cell Lymphoma,disease_has_normal_cell_origin,"['C0024264', 'C1512385', 'C1513029', 'C1515139', 'C1515880', 'C1519006']","['Lymphocyte', 'Hematopoietic and Lymphoid Cell', 'Mature T-Lymphocyte', 'T-Lymphocyte and Natural Killer Cell', 'Activated Mature Cytotoxic T-Lymphocyte', 'Peripheral (Post-Thymic) T-Lymphocyte and Natural Killer Cell']",Lymphocyte || Hematopoietic and Lymphoid Cell || Mature T-Lymphocyte || T-Lymphocyte and Natural Killer Cell || Activated Mature Cytotoxic T-Lymphocyte || Peripheral (Post-Thymic) T-Lymphocyte and Natural Killer Cell,C0024264 || C1512385 || C1513029 || C1515139 || C1515880 || C1519006,6,6,0.0,0.07028388048820507
C0079773,Primary Cutaneous T-Cell Non-Hodgkin Lymphoma,disease_has_normal_cell_origin,"['C0024264', 'C1512385', 'C1515139', 'C1519006']","['Lymphocyte', 'Hematopoietic and Lymphoid Cell', 'T-Lymphocyte and Natural Killer Cell', 'Peripheral (Post-Thymic) T-Lymphocyte and Natural Killer Cell']",Lymphocyte || Hematopoietic and Lymphoid Cell || T-Lymphocyte and Natural Killer Cell || Peripheral (Post-Thymic) T-Lymphocyte and Natural Killer Cell,C0024264 || C1512385 || C1515139 || C1519006,4,4,0.0,0.0
C4727010,Unresectable Pancreatic Neuroendocrine Carcinoma,disease_has_normal_cell_origin,"['C0014597', 'C1522529', 'C3899265']","['Epithelial Cell', 'Islet Cell', 'Endocrine Cell of the Digestive System']",Epithelial Cell || Islet Cell || Endocrine Cell of the Digestive System,C0014597 || C1522529 || C3899265,3,3,0.0,0.0
C4528572,Prognostic Stage IA Breast Cancer AJCC v8,disease_has_normal_cell_origin,['C0014597'],['Epithelial Cell'],Epithelial Cell,C0014597,1,1,0.0,0.0
C0010701,Phyllodes Tumor,disease_has_normal_cell_origin,"['C0007634', 'C0162597']","['Cell', 'Stromal Cell']",Cell || Stromal Cell,C0007634 || C0162597,2,2,0.0,0.0
C4050064,ROSE Cluster 5,disease_has_normal_cell_origin,"['C0024264', 'C0229613', 'C1512385']","['Lymphocyte', 'Lymphoblast', 'Hematopoietic and Lymphoid Cell']",Lymphocyte || Lymphoblast || Hematopoietic and Lymphoid Cell,C0024264 || C0229613 || C1512385,3,3,0.0,0.0
C4687709,"Recurrent Medulloblastoma, SHH-Activated",disease_has_normal_cell_origin,['C1947950'],['Embryonic Cell'],Embryonic Cell,C1947950,1,1,0.0,0.0
C1332508,Benign Intracranial Meningioma,disease_has_normal_cell_origin,['C1513123'],['Meningothelial Cell'],Meningothelial Cell,C1513123,1,1,0.0,0.0
C3272425,Gastric Schwannoma,disease_has_normal_cell_origin,"['C0036387', 'C1518293', 'C1518981']","['Schwann Cell', 'Neuron, Neuroepithelial Cell, and Supporting Cell of the Nervous System', 'Perineural Cell']","Schwann Cell || Neuron, Neuroepithelial Cell, and Supporting Cell of the Nervous System || Perineural Cell",C0036387 || C1518293 || C1518981,3,3,0.0,0.0
C5204611,Bladder Melanoma,disease_has_normal_cell_origin,['C0025201'],['Melanocyte'],Melanocyte,C0025201,1,1,0.0,0.0
C1335116,Oral Cavity Adenoma,disease_has_normal_cell_origin,['C0014597'],['Epithelial Cell'],Epithelial Cell,C0014597,1,1,0.0,0.0
C1518315,Nevus of Female Genitalia,disease_has_normal_cell_origin,['C0025201'],['Melanocyte'],Melanocyte,C0025201,1,1,0.0,0.0
C4725706,HHV8-Positive Germinotropic Lymphoproliferative Disorder,disease_has_normal_cell_origin,"['C0024264', 'C1512385']","['Lymphocyte', 'Hematopoietic and Lymphoid Cell']",Lymphocyte || Hematopoietic and Lymphoid Cell,C0024264 || C1512385,2,2,0.0,0.0
C4722524,Blood Vessel Neoplasm,disease_has_normal_cell_origin,['C0225336'],['Endothelial Cell'],Endothelial Cell,C0225336,1,1,0.0,0.0
C2986662,Multifocal Breast Carcinoma,disease_has_normal_cell_origin,['C0014597'],['Epithelial Cell'],Epithelial Cell,C0014597,1,1,0.0,0.0
C3273138,Extrahepatic Bile Duct Neuroendocrine Neoplasm,disease_has_normal_cell_origin,"['C0014597', 'C3899265']","['Epithelial Cell', 'Endocrine Cell of the Digestive System']",Epithelial Cell || Endocrine Cell of the Digestive System,C0014597 || C3899265,2,2,0.0,0.0
C1333050,Ciliary Body Epithelioid Cell Melanoma,disease_has_normal_cell_origin,['C0025201'],['Melanocyte'],Melanocyte,C0025201,1,1,0.0,0.0
C2987397,Gastric Carcinoma with Lymphoid Stroma,disease_has_normal_cell_origin,"['C0014597', 'C1517548']","['Epithelial Cell', 'Glandular Cell']",Epithelial Cell || Glandular Cell,C0014597 || C1517548,2,2,0.0,0.0
C0862793,Stage IIIB Lung Adenocarcinoma AJCC v7,disease_has_normal_cell_origin,['C0014597'],['Epithelial Cell'],Epithelial Cell,C0014597,1,1,0.0,0.0
C5420396,Primary Bone Diffuse Large B-Cell Lymphoma,disease_has_normal_cell_origin,"['C0004561', 'C0024264', 'C1512385', 'C1513019']","['B-Lymphocyte', 'Lymphocyte', 'Hematopoietic and Lymphoid Cell', 'Mature B-Lymphocyte']",B-Lymphocyte || Lymphocyte || Hematopoietic and Lymphoid Cell || Mature B-Lymphocyte,C0004561 || C0024264 || C1512385 || C1513019,4,4,0.0,0.0
C4723619,Brain Ependymoma,disease_has_normal_cell_origin,"['C0027836', 'C0228092', 'C1449624', 'C1518293']","['Glial Cell', 'Ependymal Cell', 'Neuroepithelial Cell', 'Neuron, Neuroepithelial Cell, and Supporting Cell of the Nervous System']","Glial Cell || Ependymal Cell || Neuroepithelial Cell || Neuron, Neuroepithelial Cell, and Supporting Cell of the Nervous System",C0027836 || C0228092 || C1449624 || C1518293,4,4,0.0,0.0
C5206442,Stage IB3 Cervical Cancer FIGO 2018,disease_has_normal_cell_origin,['C0014597'],['Epithelial Cell'],Epithelial Cell,C0014597,1,1,0.0,0.0
C4528215,Lymphomatoid Papulosis with DUSP22-IRF4 Gene Rearrangement,disease_has_normal_cell_origin,"['C0024264', 'C1512385', 'C1515139', 'C1519006', 'C1519602']","['Lymphocyte', 'Hematopoietic and Lymphoid Cell', 'T-Lymphocyte and Natural Killer Cell', 'Peripheral (Post-Thymic) T-Lymphocyte and Natural Killer Cell', 'Activated Skin-Homing T-Lymphocyte']",Lymphocyte || Hematopoietic and Lymphoid Cell || T-Lymphocyte and Natural Killer Cell || Peripheral (Post-Thymic) T-Lymphocyte and Natural Killer Cell || Activated Skin-Homing T-Lymphocyte,C0024264 || C1512385 || C1515139 || C1519006 || C1519602,5,5,0.0,0.0
C4521490,Stage III Adult Liver Cancer AJCC v7,disease_has_normal_cell_origin,['C0014597'],['Epithelial Cell'],Epithelial Cell,C0014597,1,1,0.0,0.0
C1335435,Pleural Schwannoma,disease_has_normal_cell_origin,"['C0036387', 'C1518293', 'C1518981']","['Schwann Cell', 'Neuron, Neuroepithelial Cell, and Supporting Cell of the Nervous System', 'Perineural Cell']","Schwann Cell || Neuron, Neuroepithelial Cell, and Supporting Cell of the Nervous System || Perineural Cell",C0036387 || C1518293 || C1518981,3,3,0.0,0.0
C2981348,Stage III Lung Cancer AJCC v6,disease_has_normal_cell_origin,['C0014597'],['Epithelial Cell'],Epithelial Cell,C0014597,1,1,0.0,0.0
C1336323,Ann Arbor Stage II Supradiaphragmatic Lymphocyte-Depleted Classic Hodgkin Lymphoma,disease_has_normal_cell_origin,"['C0024264', 'C1512385', 'C1513026']","['Lymphocyte', 'Hematopoietic and Lymphoid Cell', 'Mature Lymphocyte']",Lymphocyte || Hematopoietic and Lymphoid Cell || Mature Lymphocyte,C0024264 || C1512385 || C1513026,3,3,0.0,0.0
C0855106,Ann Arbor Stage I Burkitt Lymphoma,disease_has_normal_cell_origin,"['C0004561', 'C0024264', 'C1512385', 'C1513019', 'C1517532']","['B-Lymphocyte', 'Lymphocyte', 'Hematopoietic and Lymphoid Cell', 'Mature B-Lymphocyte', 'Germinal Center B-Lymphocyte']",B-Lymphocyte || Lymphocyte || Hematopoietic and Lymphoid Cell || Mature B-Lymphocyte || Germinal Center B-Lymphocyte,C0004561 || C0024264 || C1512385 || C1513019 || C1517532,5,5,0.0,0.0
C0684358,Benign Sebaceous Neoplasm,disease_has_normal_cell_origin,"['C0014597', 'C1710037']","['Epithelial Cell', 'Sebocyte']",Epithelial Cell || Sebocyte,C0014597 || C1710037,2,2,0.0,0.0
C3899981,BCLC Stage A Adult Hepatocellular Carcinoma,disease_has_normal_cell_origin,"['C0014597', 'C0227525']","['Epithelial Cell', 'Hepatocyte']",Epithelial Cell || Hepatocyte,C0014597 || C0227525,2,2,0.0,0.0
C4725817,Refractory Malignant Endocrine Neoplasm,disease_has_normal_cell_origin,['C0014597'],['Epithelial Cell'],Epithelial Cell,C0014597,1,1,0.0,0.0
C1336476,Stage I Pleural Malignant Mesothelioma AJCC v7,disease_has_normal_cell_origin,['C0225335'],['Mesothelial Cell'],Mesothelial Cell,C0225335,1,1,0.0,0.0
C5419794,Colorectal Poorly Cohesive Adenocarcinoma,disease_has_normal_cell_origin,"['C0014597', 'C1517548']","['Epithelial Cell', 'Glandular Cell']",Epithelial Cell || Glandular Cell,C0014597 || C1517548,2,2,0.0,0.0
C5420857,Resectable Pancreatic Adenosquamous Carcinoma,disease_has_normal_cell_origin,"['C0007634', 'C0014597']","['Cell', 'Epithelial Cell']",Cell || Epithelial Cell,C0007634 || C0014597,2,2,0.0,0.0
C5401097,High Grade Appendix Mucinous Neoplasm,disease_has_normal_cell_origin,['C0014597'],['Epithelial Cell'],Epithelial Cell,C0014597,1,1,0.0,0.0
C4727363,Recurrent Anal Adenocarcinoma,disease_has_normal_cell_origin,['C0014597'],['Epithelial Cell'],Epithelial Cell,C0014597,1,1,0.0,0.0
C3897520,Stage IVA Rectal Cancer AJCC v7,disease_has_normal_cell_origin,['C0014597'],['Epithelial Cell'],Epithelial Cell,C0014597,1,1,0.0,0.0
C4744996,Recurrent T-Cell/Histiocyte-Rich Large B-Cell Lymphoma,disease_has_normal_cell_origin,"['C0004561', 'C0024264', 'C1512385', 'C1513019', 'C1517532']","['B-Lymphocyte', 'Lymphocyte', 'Hematopoietic and Lymphoid Cell', 'Mature B-Lymphocyte', 'Germinal Center B-Lymphocyte']",B-Lymphocyte || Lymphocyte || Hematopoietic and Lymphoid Cell || Mature B-Lymphocyte || Germinal Center B-Lymphocyte,C0004561 || C0024264 || C1512385 || C1513019 || C1517532,5,5,0.0,0.0
C1336055,Spindle Cell Type B Uveal Melanoma,disease_has_normal_cell_origin,['C0025201'],['Melanocyte'],Melanocyte,C0025201,1,1,0.0,0.0
C1335433,Pleural Carcinomatosis,disease_has_normal_cell_origin,['C0014597'],['Epithelial Cell'],Epithelial Cell,C0014597,1,1,0.0,0.0
C2698312,B Lymphoblastic Leukemia/Lymphoma with Hypodiploidy,disease_has_normal_cell_origin,"['C0004561', 'C0024264', 'C0229613', 'C1512385', 'C1516097']","['B-Lymphocyte', 'Lymphocyte', 'Lymphoblast', 'Hematopoietic and Lymphoid Cell', 'Precursor B-Lymphoblast']",B-Lymphocyte || Lymphocyte || Lymphoblast || Hematopoietic and Lymphoid Cell || Precursor B-Lymphoblast,C0004561 || C0024264 || C0229613 || C1512385 || C1516097,5,5,0.0,0.0
C1333176,Skin Lymphangioma,disease_has_normal_cell_origin,['C0225336'],['Endothelial Cell'],Endothelial Cell,C0225336,1,1,0.0,0.0
C0279623,Adult Acute Myeloid Leukemia without Maturation,disease_has_normal_cell_origin,"['C1511246', 'C1511247', 'C1512385']","['Bone Marrow Stem Cell', 'Bone Marrow Stem Cell at the Earliest Stage of Myeloid Differentiation', 'Hematopoietic and Lymphoid Cell']",Bone Marrow Stem Cell || Bone Marrow Stem Cell at the Earliest Stage of Myeloid Differentiation || Hematopoietic and Lymphoid Cell,C1511246 || C1511247 || C1512385,3,3,0.0,0.03921568475201852
C1709884,Regional Adrenal Gland Pheochromocytoma,disease_has_normal_cell_origin,"['C0014597', 'C0376604', 'C1709215']","['Epithelial Cell', 'Chromaffin Cell', 'Neural Crest-Derived Cell']",Epithelial Cell || Chromaffin Cell || Neural Crest-Derived Cell,C0014597 || C0376604 || C1709215,3,3,0.0,0.0
C4682932,Bladder Cancer by AJCC v8 Stage,disease_has_normal_cell_origin,['C0014597'],['Epithelial Cell'],Epithelial Cell,C0014597,1,1,0.0,0.0
C2698305,B Acute Lymphoblastic Leukemia with t(12;21)(p13.2;q22.1); ETV6-RUNX1,disease_has_normal_cell_origin,"['C0004561', 'C0024264', 'C0229613', 'C1512385', 'C1516097']","['B-Lymphocyte', 'Lymphocyte', 'Lymphoblast', 'Hematopoietic and Lymphoid Cell', 'Precursor B-Lymphoblast']",B-Lymphocyte || Lymphocyte || Lymphoblast || Hematopoietic and Lymphoid Cell || Precursor B-Lymphoblast,C0004561 || C0024264 || C0229613 || C1512385 || C1516097,5,5,0.0,0.0
C3273009,Beta-Catenin-Activated Hepatocellular Adenoma,disease_has_normal_cell_origin,"['C0014597', 'C0227525']","['Epithelial Cell', 'Hepatocyte']",Epithelial Cell || Hepatocyte,C0014597 || C0227525,2,2,0.0,0.0
C1883403,Sweat Gland Tubular Carcinoma,disease_has_normal_cell_origin,['C0014597'],['Epithelial Cell'],Epithelial Cell,C0014597,1,1,0.0,0.0
C0032131,Plasmacytoma,disease_has_normal_cell_origin,"['C0004561', 'C0024264', 'C0032112', 'C1512385', 'C1513019']","['B-Lymphocyte', 'Lymphocyte', 'Plasma Cell', 'Hematopoietic and Lymphoid Cell', 'Mature B-Lymphocyte']",B-Lymphocyte || Lymphocyte || Plasma Cell || Hematopoietic and Lymphoid Cell || Mature B-Lymphocyte,C0004561 || C0024264 || C0032112 || C1512385 || C1513019,5,5,0.0,0.0
C1368918,Primary Peritoneal Serous Papillary Adenocarcinoma,disease_has_normal_cell_origin,['C0014597'],['Epithelial Cell'],Epithelial Cell,C0014597,1,1,0.0,0.0
C2825149,Myeloid Leukemia Associated with Down Syndrome,disease_has_normal_cell_origin,"['C0018956', 'C1511246', 'C1512385']","['Hematopoietic Stem Cell', 'Bone Marrow Stem Cell', 'Hematopoietic and Lymphoid Cell']",Hematopoietic Stem Cell || Bone Marrow Stem Cell || Hematopoietic and Lymphoid Cell,C0018956 || C1511246 || C1512385,3,3,0.0,0.0
C0279541,Adult Nodular Sclerosis Classic Hodgkin Lymphoma,disease_has_normal_cell_origin,"['C0024264', 'C1512385', 'C1513026']","['Lymphocyte', 'Hematopoietic and Lymphoid Cell', 'Mature Lymphocyte']",Lymphocyte || Hematopoietic and Lymphoid Cell || Mature Lymphocyte,C0024264 || C1512385 || C1513026,3,3,0.0,0.0
C4086173,Childhood Testicular Immature Teratoma,disease_has_normal_cell_origin,['C0017471'],['Germ Cell'],Germ Cell,C0017471,1,1,0.0,0.0
C0853105,Penile Carcinoma,disease_has_normal_cell_origin,['C0014597'],['Epithelial Cell'],Epithelial Cell,C0014597,1,1,0.0,0.0
C3647834,Grade 3a Follicular Lymphoma,disease_has_normal_cell_origin,"['C0004561', 'C0024264', 'C1512385', 'C1513019', 'C1517532']","['B-Lymphocyte', 'Lymphocyte', 'Hematopoietic and Lymphoid Cell', 'Mature B-Lymphocyte', 'Germinal Center B-Lymphocyte']",B-Lymphocyte || Lymphocyte || Hematopoietic and Lymphoid Cell || Mature B-Lymphocyte || Germinal Center B-Lymphocyte,C0004561 || C0024264 || C1512385 || C1513019 || C1517532,5,5,0.0,0.0
C1336753,Thyroid Gland Lymphoma,disease_has_normal_cell_origin,"['C0024264', 'C1512385']","['Lymphocyte', 'Hematopoietic and Lymphoid Cell']",Lymphocyte || Hematopoietic and Lymphoid Cell,C0024264 || C1512385,2,2,0.0,0.0
C1333452,Esophageal Hodgkin Lymphoma,disease_has_normal_cell_origin,"['C0024264', 'C1512385', 'C1513026']","['Lymphocyte', 'Hematopoietic and Lymphoid Cell', 'Mature Lymphocyte']",Lymphocyte || Hematopoietic and Lymphoid Cell || Mature Lymphocyte,C0024264 || C1512385 || C1513026,3,3,0.0,0.0
C4527182,Pathologic Stage IIB Cutaneous Melanoma AJCC v8,disease_has_normal_cell_origin,['C0025201'],['Melanocyte'],Melanocyte,C0025201,1,1,0.0,0.0
C1960398,HER2 Positive Breast Carcinoma,disease_has_normal_cell_origin,['C0014597'],['Epithelial Cell'],Epithelial Cell,C0014597,1,1,0.0,0.0
C1707437,Colorectal Adenosquamous Carcinoma,disease_has_normal_cell_origin,"['C0007634', 'C0014597']","['Cell', 'Epithelial Cell']",Cell || Epithelial Cell,C0007634 || C0014597,2,2,0.0,0.0
C1336240,Stage III AIDS-Related Anal Canal Cancer AJCC v6 and v7,disease_has_normal_cell_origin,['C0014597'],['Epithelial Cell'],Epithelial Cell,C0014597,1,1,0.0,0.0
C5206797,Metastatic Gallbladder Carcinoma,disease_has_normal_cell_origin,['C0014597'],['Epithelial Cell'],Epithelial Cell,C0014597,1,1,0.0,0.0
C3273124,Gallbladder Tubular Carcinoid,disease_has_normal_cell_origin,"['C0014597', 'C3899265']","['Epithelial Cell', 'Endocrine Cell of the Digestive System']",Epithelial Cell || Endocrine Cell of the Digestive System,C0014597 || C3899265,2,2,0.0,0.0
C4321358,Immune-Mediated Coagulopathy,disease_has_normal_cell_origin,['C1512385'],['Hematopoietic and Lymphoid Cell'],Hematopoietic and Lymphoid Cell,C1512385,1,1,0.0,0.0
C2936755,Familial Waldenstrom Macroglobulinemia,disease_has_normal_cell_origin,"['C0004561', 'C0024264', 'C1512385', 'C1513019', 'C1518994']","['B-Lymphocyte', 'Lymphocyte', 'Hematopoietic and Lymphoid Cell', 'Mature B-Lymphocyte', 'Peripheral B-Lymphocyte']",B-Lymphocyte || Lymphocyte || Hematopoietic and Lymphoid Cell || Mature B-Lymphocyte || Peripheral B-Lymphocyte,C0004561 || C0024264 || C1512385 || C1513019 || C1518994,5,5,0.0,0.0
C1336334,Stage IVA Uterine Corpus Cancer AJCC v7,disease_has_normal_cell_origin,['C0524457'],['Endometrial Glandular Cell'],Endometrial Glandular Cell,C0524457,1,1,0.0,0.0
C5204294,Warty-Basaloid Carcinoma of the Penis,disease_has_normal_cell_origin,"['C0014597', 'C0221910']","['Epithelial Cell', 'Squamous Cell']",Epithelial Cell || Squamous Cell,C0014597 || C0221910,2,2,0.0,0.0
C4553413,Stage IIB Cervical Cancer AJCC v8,disease_has_normal_cell_origin,['C0014597'],['Epithelial Cell'],Epithelial Cell,C0014597,1,1,0.0,0.0
C0345967,Malignant Mesothelioma,disease_has_normal_cell_origin,['C0225335'],['Mesothelial Cell'],Mesothelial Cell,C0225335,1,1,0.0,0.0
C2981258,Stage IVB Mucosal Melanoma of the Head and Neck AJCC v7,disease_has_normal_cell_origin,['C0025201'],['Melanocyte'],Melanocyte,C0025201,1,1,0.0,0.0
C0334121,Inflammatory Myofibroblastic Tumor,disease_has_normal_cell_origin,"['C0009781', 'C0016030']","['Connective and Soft Tissue Cell', 'Fibroblast']",Connective and Soft Tissue Cell || Fibroblast,C0009781 || C0016030,2,2,0.0,0.0
C1335489,Breast Non-Hodgkin Lymphoma,disease_has_normal_cell_origin,"['C0024264', 'C1512385']","['Lymphocyte', 'Hematopoietic and Lymphoid Cell']",Lymphocyte || Hematopoietic and Lymphoid Cell,C0024264 || C1512385,2,2,0.0,0.0
C1332610,Brain Stem Glioblastoma,disease_has_normal_cell_origin,"['C0004112', 'C0027836', 'C1449624', 'C1518293']","['Astrocyte', 'Glial Cell', 'Neuroepithelial Cell', 'Neuron, Neuroepithelial Cell, and Supporting Cell of the Nervous System']","Astrocyte || Glial Cell || Neuroepithelial Cell || Neuron, Neuroepithelial Cell, and Supporting Cell of the Nervous System",C0004112 || C0027836 || C1449624 || C1518293,4,4,0.0,0.0
C1334412,Low Grade Anal Canal Intraepithelial Neoplasia,disease_has_normal_cell_origin,"['C0014597', 'C0221910']","['Epithelial Cell', 'Squamous Cell']",Epithelial Cell || Squamous Cell,C0014597 || C0221910,2,2,0.0,0.0
C4520821,Stage 0 Breast Cancer AJCC v6 and v7,disease_has_normal_cell_origin,"['C0014597', 'C1515275']","['Epithelial Cell', 'Terminal Ductal Lobular Unit Cell']",Epithelial Cell || Terminal Ductal Lobular Unit Cell,C0014597 || C1515275,2,2,0.0,0.0
C1337012,Well Differentiated Papillary Mesothelioma,disease_has_normal_cell_origin,['C0225335'],['Mesothelial Cell'],Mesothelial Cell,C0225335,1,1,0.0,0.0
C1334651,Mediastinal Choriocarcinoma,disease_has_normal_cell_origin,['C0017471'],['Germ Cell'],Germ Cell,C0017471,1,1,0.0,0.0
C0278751,Localized Malignant Mesothelioma,disease_has_normal_cell_origin,['C0225335'],['Mesothelial Cell'],Mesothelial Cell,C0225335,1,1,0.0,0.0
C4524712,Clinical Stage I Gastroesophageal Junction Adenocarcinoma AJCC v8,disease_has_normal_cell_origin,['C0014597'],['Epithelial Cell'],Epithelial Cell,C0014597,1,1,0.0,0.0
C1292779,Myelodysplastic Syndrome with Isolated del(5q),disease_has_normal_cell_origin,"['C1511246', 'C1512385']","['Bone Marrow Stem Cell', 'Hematopoietic and Lymphoid Cell']",Bone Marrow Stem Cell || Hematopoietic and Lymphoid Cell,C1511246 || C1512385,2,2,0.0,0.0
C4682640,Stage IVA Primary Peritoneal Cancer AJCC v8,disease_has_normal_cell_origin,['C0014597'],['Epithelial Cell'],Epithelial Cell,C0014597,1,1,0.0,0.0
C2347539,Adult Acute Myeloid Leukemia with Recurrent Genetic Abnormalities,disease_has_normal_cell_origin,"['C1511246', 'C1512385']","['Bone Marrow Stem Cell', 'Hematopoietic and Lymphoid Cell']",Bone Marrow Stem Cell || Hematopoietic and Lymphoid Cell,C1511246 || C1512385,2,2,0.0,0.0
C5418989,Recurrent Hairy Cell Leukemia Variant,disease_has_normal_cell_origin,"['C0004561', 'C0024264', 'C1512385', 'C1513019']","['B-Lymphocyte', 'Lymphocyte', 'Hematopoietic and Lymphoid Cell', 'Mature B-Lymphocyte']",B-Lymphocyte || Lymphocyte || Hematopoietic and Lymphoid Cell || Mature B-Lymphocyte,C0004561 || C0024264 || C1512385 || C1513019,4,4,0.0,0.05555555432098768
C1334653,Mediastinal Ganglioneuroblastoma,disease_has_normal_cell_origin,"['C1449624', 'C1518272', 'C1518293', 'C1947950']","['Neuroepithelial Cell', 'Neuroectodermal Cell', 'Neuron, Neuroepithelial Cell, and Supporting Cell of the Nervous System', 'Embryonic Cell']","Neuroepithelial Cell || Neuroectodermal Cell || Neuron, Neuroepithelial Cell, and Supporting Cell of the Nervous System || Embryonic Cell",C1449624 || C1518272 || C1518293 || C1947950,4,4,0.0,0.0
C2217035,Stage IIA Colon Cancer AJCC v7,disease_has_normal_cell_origin,['C0014597'],['Epithelial Cell'],Epithelial Cell,C0014597,1,1,0.0,0.0
C1332241,Ameloblastic Carcinoma-Secondary Type (Dedifferentiated),disease_has_normal_cell_origin,"['C0002449', 'C0014597']","['Ameloblast', 'Epithelial Cell']",Ameloblast || Epithelial Cell,C0002449 || C0014597,2,2,0.0,0.0
C2981706,Stage IIA Uveal Melanoma AJCC v7,disease_has_normal_cell_origin,['C0025201'],['Melanocyte'],Melanocyte,C0025201,1,1,0.0,0.0
C4520840,Erythroleukemia,disease_has_normal_cell_origin,"['C1511246', 'C1512385', 'C1709095']","['Bone Marrow Stem Cell', 'Hematopoietic and Lymphoid Cell', 'Multipotent Bone Marrow Stem Cell with Wide Myeloid Potential']",Bone Marrow Stem Cell || Hematopoietic and Lymphoid Cell || Multipotent Bone Marrow Stem Cell with Wide Myeloid Potential,C1511246 || C1512385 || C1709095,3,3,0.0,0.0
C5418913,Unresectable Fallopian Tube Adenocarcinoma,disease_has_normal_cell_origin,['C0014597'],['Epithelial Cell'],Epithelial Cell,C0014597,1,1,0.0,0.0
C1336422,Stage IV Lip Cancer AJCC v6 and v7,disease_has_normal_cell_origin,['C0014597'],['Epithelial Cell'],Epithelial Cell,C0014597,1,1,0.0,0.0
C4521812,Stage IIIA Appendix Carcinoma AJCC v8,disease_has_normal_cell_origin,['C0014597'],['Epithelial Cell'],Epithelial Cell,C0014597,1,1,0.0,0.0
